{
  "schema_version": 3,
  "generated_at": "2026-08-10T14:00:00Z",
  "scope_id": "ACT-LEAMAS-V3-MINIMAL",
  "scope_status": "OPEN",
  "scope_disposition": "v3 minimal canonical fixture",
  "parent_act": "ACT-LEAMAS-V3-MINIMAL",
  "parent_status": "CLOSED",
  "parent_disposition": "v3 minimal canonical fixture",
  "overall_status": "pass",
  "overall_disposition": "v3 minimal canonical fixture",
  "execution_head_oid": "0123456789abcdef0123456789abcdef01234567",
  "execution_tree_oid": "0123456789abcdef0123456789abcdef01234567",
  "subject_tree_oid": "0123456789abcdef0123456789abcdef01234567",
  "worktree_clean_before": true,
  "worktree_clean_after": true,
  "registry_sha256": "e3b0c44298fc1c149afbf4c8996fb92427ae41e4649b934ca495991b7852b855",
  "events_sha256": "e3b0c44298fc1c149afbf4c8996fb92427ae41e4649b934ca495991b7852b855",
  "transcript_sha256": "e3b0c44298fc1c149afbf4c8996fb92427ae41e4649b934ca495991b7852b855",
  "counts": {
    "total": 1,
    "pass": 1,
    "fail": 0,
    "timeout": 0,
    "skip": 0,
    "unavailable": 0
  },
  "failed_names": [],
  "timeout_names": [],
  "skipped_names": [],
  "unavailable_names": [],
  "checks": [
    {
      "id": "v3-minimal-check",
      "name": "v3 minimal check",
      "scope": "ROOT",
      "order": 1,
      "execution_class": "required",
      "status": "pass",
      "detail": "v3 minimal canonical fixture",
      "argv": ["true"],
      "implementation": "e3b0c44298fc1c149afbf4c8996fb92427ae41e4649b934ca495991b7852b855",
      "duration_ms": 0,
      "deadline_exceeded": false,
      "canonical_exit_code": 0,
      "raw_process_exit_code": 0,
      "termination_signal": null,
      "stdout_sha256": "e3b0c44298fc1c149afbf4c8996fb92427ae41e4649b934ca495991b7852b855",
      "stderr_sha256": "e3b0c44298fc1c149afbf4c8996fb92427ae41e4649b934ca495991b7852b855",
      "stdout_bytes": 0,
      "stderr_bytes": 0,
      "stdout_truncated": false,
      "stderr_truncated": false
    }
  ]
}
